N£mero;Ano;Tipo;Mat‚ria;Ementa;Dt. Tramita‡Æo;Setor;Autores;Situa‡Æo;Veto;Lei
1100;2015;PLL;94;CONCEDE O TITULO DE CIDADAO EMERITO DE PORTO ALEGRE AO SENHOR PETERSON UNGARETTI.;21/01/2016;ARQ - SETOR DE ARQUIVO;PAULO BRUM;APROVADO;;11880
1091;2015;PLL;93;CONCEDE O TITULO DE CIDADAO EMERITO DE PORTO ALEGRE AO SENHOR GUACIR DE LLANO BUENO.;11/12/2015;ARQ - SETOR DE ARQUIVO;JOAO BOSCO VAZ;APROVADO;;11931
1072;2015;PLL;91;DENOMINA RUA 17 DE DEZEMBRO O LOGRADOURO NAO CADASTRADO CONHECIDO COMO RUA MIL E SESSENTA E OITO, LOCALIZADO NO BAIRRO PRAIA DE BELAS.;21/01/2016;ARQ - SETOR DE ARQUIVO;MARCIO BINS ELY;APROVADO;;11961
1040;2015;PR;19;ALTERA O CAPUT E SEUS INCS. I E II NO ART. 4. E O ART. 5. E REVOGA O INC. III DO CAPUT E O PARAGRAFO 3. DO ART. 4. E O ART. 7. DA RESOLUCAO N. 1.559, DE 22 DE AGOSTO DE 2001, E ALTERACOES POSTERIORES, EXTINGUINDO OS POSTOS PARA ESTAGIO EXTRACURRICULAR LOTADOS NOS GABINETES PARLAMENTARES DA CAMARA MUNICIPAL DE PORTO ALEGRE (CMPA).;05/04/2016;ARQ - SETOR DE ARQUIVO;MESA DIRETORA;APROVADO;;2367
1039;2015;PLE;9;AUTORIZA A ABERTURA DE CREDITOS ESPECIAIS NO EXECUTIVO MUNICIPAL, NO VALOR DE R$ 3.947.000,00 (TRES MILHOES E NOVECENTOS E QUARENTA E SETE MIL REAIS), E DA OUTRAS PROVIDENCIAS.;21/01/2016;ARQ - SETOR DE ARQUIVO;GOVERNO MUNICIPAL;APROVADO;;11883
1024;2015;PLL;85;CONCEDE O TITULO DE CIDADAO EMERITO DE PORTO ALEGRE , IN MEMORIAM, AO SENHOR JOEL FAGUNDES.;21/01/2016;ARQ - SETOR DE ARQUIVO;TARCISO FLECHA NEGRA                              ;APROVADO;;11908
1015;2015;PLL;84;DENOMINA RUA CELSO DIAS DIHL O LOGRADOURO PUBLICO CADASTRADO CONHECIDO COMO RUA 8830 - LOTEAMENTO RESIDENCIAL PARQUE DO RINCAO -, LOCALIZADO NO BAIRRO RESTINGA, NO TRECHO QUE INICIA NO LIMITE SUDOESTE DO LOTEAMENTO PARQUE DO RINCAO E TERMINA 20M (VINTE METROS) APOS A RUA DIRETRIZ 7124.;21/01/2016;ARQ - SETOR DE ARQUIVO;JOAO CARLOS NEDEL;APROVADO;;11920
980;2015;PR;16;CONCEDE O DIPLOMA HONRA AO MERITO A ASSOCIACAO DOS DELEGADOS DE POLICIA DO RGS - ASDEP.;17/12/2015;ARQ - SETOR DE ARQUIVO;DELEGADO CLEITON;APROVADO;;
975;2015;PLL;81;INSTITUI O PROGRAMA LICITACAO SUSTENTAVEL.;12/05/2016;ARQ - SETOR DE ARQUIVO;AIRTO FERRONATO;APROVADO;;11993
943;2015;PLE;7;"ALTERA A REDACAO DO ART. 14 DA LEI N. 11.400, DE 27 DE DEZEMBRO DE 2012, QUE ALTERA A EMENTA, OS ARTS. 1, 2., CAPUT E INCS. II E III, 3., 5., 8. 9., CAPUT E INCS. II, III E IV, 10 E 14, INCLUI INCS. IV A VII NO ART. 2. E REVOGA O PARAGRAFO UNICO DO ART. 2. E O INC. I DO ART. 9., TODOS DA LEI N. 9.693, DE 29 DE DEZEMBRO DE 2004, E ALTERACOES POSTERIORES, ALTERANDO A DENOMINACAO DA SECRETARIA MUNICIPAL DE GESTAO E ACOMPANHAMENTO ESTRATEGICOS (SMGAE) PARA SECRETARIA MUNICIPAL DE GESTAO (SMGES) E DA SECRETARIA MUNICIPAL DE COORDENACAO POLITICA E GOVERNANCA LOCAL (SMCPGL) PARA SECRETARIA MUNICIPAL DE GOVERNANCA LOCAL (SMGL) E ESTABELECENDO-LHES FINALIDADES BASICAS; ALTERA O ANEXO I E INCLUI ANEXO III-B NA LEI N. 6.309, DE 28 DE DEZEMBRO DE 1988, E ALTERACOES POSTERIORES, EXCLUINDO E CRIANDO CARGOS EM COMISSAO E FUNCOES GRATIFICADAS; E.";12/05/2016;ARQ - SETOR DE ARQUIVO;GOVERNO MUNICIPAL;APROVADO;VETO PARCIAL MANTIDO;11890
884;2015;PLCE;9;ALTERA O PARAGRAFO 3. DO ART. 1., O CAPUT DO ART. 7., O PARAGRAFO 3. DO ART. 8., O CAPUT DO ART. 9., O CAPUT DO ART. 14 E O CAPUT DO ART. 15., INCLUI OS INCS. I A III NO CAPUT E O PARAGRAFO UNICO E OS INCS. I A III TODOS NO ART. 14., REVOGA O INC. II DO ART. 8. E O PARAGRFO 1. DO ART. 9., DA LEI COMPLEMENTAR N. 687, DE 1. DE FEVEREIRO DE 2012, INSTITUI OBRIGACOES ACESSORIAS RELATIVAS A NOTA FISCAL DE SERVICOS ELETRONICA (NFSE) E CRIA PENALIDADES PELO SEU DESCUMPRIMENTO.;18/01/2016;ARQ - SETOR DE ARQUIVO;GOVERNO MUNICIPAL;APROVADO;;774
877;2015;PR;14;CONCEDE O DIPLOMA HONRA AO  MERITO A RADIO ESPERANCA LTDA. - ME.;21/01/2016;ARQ - SETOR DE ARQUIVO;WALDIR CANAL                                      ;APROVADO;;2379
856;2015;PLL;76;DENOMINA RUA FRANCISCO MUNHOZ DIAS, RUA JUREMA JANETE SANTIAGO, RUA ELCI FERNANDES, RUA ISABEL VACARI, RUA BRASILIA LUZ DE SOUZA, RUA SUELI MARIA DOS SANTOS, RUA ERNESTOR MORAES, RUA LEOPOLDINA DE OLIVEIRA, RUA SANTA ROSARIO GONCALVES, RUA EVA TEREZINHA DOS SANTOS E RUA ROSANGELA BRUFATTO LUZ OS LOGRADOUROS NAO CADASTRADOS CONHECIDOS, RESPECTIVAMENTE, COMO RUA TRES MIL, CENTO E QUARENTA E NOVE, RUA TRES MIL, CENTO E CINQUENTA, RUA TRES MIL, CENTO E CINQUENTA E UM, RUA TRES MIL, CENTO E CINQUENTA E DOIS, RUA TRES MIL CENTO E CINQUENTA E TRES, RUA TRES MIL, CENTO E CINQUENTA E QUATRO, RUA TRES MIL, CENTO E CINQUENTA E CINCO, RUA TRES MIL, CENTO E CINQUENTA E SETE, RUA TRES MIL, CENTO E CINQUENTA E OITO, RUA TRES MIL, CENTO E CINQUENTA E NOVE E RUA TRES MIL, CENTO E SESSENTA.;01/04/2016;VER. WALDIR CANAL                                 ;JOAO CARLOS NEDEL;APROVADO;;11934
854;2015;PLL;75;INCLUI A EFEMERIDE DIA DO MESTRE-SALA, DA PORTA-BANDEIRA E DO PORTA-ESTANDARTE NO ANEXO DA LEI N. 10.904, DE 31 DE MAIO DE 2010 - CALENDARIO DE DATAS COMEMORATIVAS E DE CONSCIENTIZACAO DO MUNICIPIO DE PORTO ALEGRE -, E ALTERACOES POSTERIORES, NO DIA 6 DE NOVEMBRO.;05/04/2016;ARQ - SETOR DE ARQUIVO;DELEGADO CLEITON;APROVADO;;11906
816;2015;PLL;72;DENOMINA RUA GLACI MARIA COSTI O LOGRADOURO PUBLICO CADASTRADO CONHECIDO COMO RUA 906 - LOTEAMENTO PARQUE DONA ALZIRA - , LOCALIZADO NO BAIRRO SARANDI.;21/01/2016;ARQ - SETOR DE ARQUIVO;JOAO CARLOS NEDEL;APROVADO;;11905
805;2015;PLL;69;DENOMINA RUA CORONEL DASTRO DUTRA, RUA CLOVIS STENZEL, RUA ADALIBIO KLEIN , RUA FERNANDO VERONEZI, RUA OLIMPIO TABAJARA, RUA SOLON VIEIRA MARQUES E RUA SIMEAO MEIRA LOGRADOUROS PUBLICOS CADASTRADOS CONHECIDOS, RESPECTIVAMENTE, COMO RUA 7124 - LOTEAMENTO RESIDENCIAL PARQUE DO RINCAO -, RUA 8826 - LOTEAMENTO RESIDENCIAL PARQUE DO RINCAO -, RUA RUA 8831 - LOTEAMENTO RESIDENCIAL PARQUE DO RINCAO -, RUA 8832 - LOTEAMENTO RESIDENCIAL PARQUE DO RINCAO -, RUA 8836 - LOTEAMENTO RESIDENCIAL PARQUE DO RINCAO -, RUA 8835 - LOTEAMENTO RESIDENCIAL PARQUE DO RINCAO -, E RUA 8834 - LOTEAMENTO RESIDENCIAL PARQUE DO RINCAO -, LOCALIZADOS NO BAIRRO RESTINGA.;15/09/2016;DL - DIRETORIA LEGISLATIVA;JOAO CARLOS NEDEL;APROVADO;;11940
795;2015;PLL;68;DENOMINA RUA ODILA BUGANCA O LOGRADOURO NAO CADASTRADO CONHECIDO COMO RUA R - VILA DO SARGENTO -, LOCALIZADO NO BAIRRO SERRARIA.;17/08/2016;ARQ - SETOR DE ARQUIVO;PROFESSOR GARCIA;APROVADO;;11970
780;2015;PLCE;8;ALTERA O ART. 18 DA LEI COMPLEMENTAR N. 755, DE 30 DE DEZEMBRO DE 2014, QUE ALTERA A LEI COMPLEMENTAR N. 7 DE 7 DE DEZEMBRO DE 1973 - QUE INSTITUI E DISCIPLINA OS TRIBUTOS DE COMPETENCIA DO MUNICIPIO -, E ALTERACOES POSTERIORES, DISPONDO SOBRE AS TAXAS DE FISCALIZACAO DE LOCALIZACAO E FUNCIONAMENTO, DE SERVICOS AMBIENTAIS DIVERSOS, DE CONTROLE E FISCALIZACAO AMBIENTAL E DE LICENCIAMENTO AMBIENTAL, E DA OUTRAS PROVIDENCIAS, AMPLIANDO A VACATIO LEGIS DA LEI COMPLEMENTAR.;04/05/2016;DL - DIRETORIA LEGISLATIVA;GOVERNO MUNICIPAL;APROVADO;;760
778;2015;PLE;6;ALTERA O ART. 3. DA LEI N. 11.752, DE 30 DE DEZEMBRO DE 2014, QUE ALTERA A EMENTA, INCLUI ART. 10-A E REVOGA OS ARTS. 14, 15, 16, 17 E 18 E OS ANEXOS I E II NA LEI N. 8.267, DE 29 DE DEZEMBRO DE 1998, E ALTERACOES POSTERIORES, INCLUINDO EXIGENCIAS AO LICENCIAMENTO AMBIENTAL NO MUNICIPIO DE PORTO ALEGRE E EXCLUINDO A TAXA DE LICENCIAMENTO AMBIENTAL (TLA), AMPLIANDO A CAVATIO LEGIS DA LEI COMPLEMENTAR.;04/05/2016;DL - DIRETORIA LEGISLATIVA;GOVERNO MUNICIPAL;APROVADO;;11813
760;2015;PLCE;5;"ALTERA OS LIMITES DA MACROZONA (MZ) 08, ENTRE AS UNIDADES DE ESTRUTURACAO URBANA (UEU) 078 E UEU 080; DAS SUBUNIDADES 01 E 09 DA UEU 078 DA MACROZONA (MZ) 08 E DAS SUBUNIDADES 01 E 02 DA UEU 080 DA MACROZONA (MZ) 08; CRIA AS SUBUNIDADES 11, 12, 13, 14, 15 E 16 DA UEU 078 DA MACROZONA (MZ) 08 E CRIA AS SBUNIDADES 05, 06, 07, 08, 09, 10, 11 E 12 DA UEU 080 DA MACROZONA (MZ) 08, CONSTANTES DO ANEXO 1.1 DA LEI COMPLEMENTAR N. 434, DE 1. DE DEZEMBRO DE 1999 - PLANO DIRETOR DE DESENVOLVIMENTO URBANO E AMBIENTAL (PDDUA), ALTERADA PELA LEI COMPLEMENTAR N. 646, DE 22 DE JULHO DE 2010, DEFINE OS RESPECTIVOS REGIMES URBANISTICOS PARA AS NOVAS SUBUNIDADES E DA OUTRAS PROVIDENCIAS.";19/10/2016;SPA - AGUARDANDO NA SECAO DE PROTOC E ARQUIVO;GOVERNO MUNICIPAL;APROVADO;;780
748;2015;PLL;66;DENOMINA RUA ROMULO DA SILVA PINHEIRO O LOGRADOURO PUBLICO CADASTRADO CONHECIDO COMO RUA 10007, LOCALIZADO NO BAIRRO LOMBA DO PINHEIRO.;05/04/2016;ARQ - SETOR DE ARQUIVO;ENGENHEIRO COMASSETTO                             ;APROVADO;;11923
742;2015;PLL;65;ALTERA A AL. A DO CAPUT DO ART. 1 DA LEI N. 3.033, DE 30 DE JUNHO DE 1967 - QUE FIXA OS FERIADOS MUNICIPAIS -, E ALTERACOES POSTERIORES, DECLARANDO FERIADO MUNICIPAL O DIA 20 DE NOVEMBRO E CONSAGRANDO - O DIA DA CONSCIENCIA NEGRA E DA DIFUSAO DA RELIOGIOSIDADE.;17/05/2016;ARQ - SETOR DE ARQUIVO;DELEGADO CLEITON;APROVADO;;11971
740;2015;PLL;64;DENOMINA PRACA MIGUEL PEREIRA DA SILVA O LOGRADOURO PUBLICO CADASTRADO CONHECIDO COMO PRACA 3028,  LOCALIZADO NO BAIRRO SARANDI.;21/01/2016;ARQ - SETOR DE ARQUIVO;JOAO CARLOS NEDEL;APROVADO;;11902
718;2015;PLL;62;DENOMINA PRACA RAUL DA SILVA BOEIRA O LOGRADOURO PUBLICO CADASTRADO CONHECIDO COMO PRACA 7097 - LOTEAMENTO NOVA RESTINGA, 4. UV -, LOCALIZADO NO BAIRRO RESTINGA.;26/07/2016;ARQ - SETOR DE ARQUIVO;JOAO CARLOS NEDEL;APROVADO;;11903
660;2015;PLL;61;DENOMINA RENALDO FRIEDRICH A PISTA ATLETICA DA PRACA TORBEN DE ALENCASTRO FRIEDRICH, LOCALIZADA NO BAIRRO JARDIM LINDOIA.;21/01/2016;ARQ - SETOR DE ARQUIVO;JOAO CARLOS NEDEL;APROVADO;;11912
658;2015;PLL;60;DENOMINA RUA ADAO LUIZ CORREA O LOGRADOURO NAO CADASTRADO CONHECIDO COMO BECO B - VILA DO SARGENTO -,  LOCALIZADO NO BAIRRO SERRARIA.;21/01/2016;ARQ - SETOR DE ARQUIVO;ELIZANDRO SABINO;APROVADO;;11896
650;2015;PLE;5;AUTORIZA O EXECUTIVO MUNICIPAL PERMUTAR PROPRIO MUNICIPAL, LOCALIZADO NA AVENIDA LOUREIRO DA SILVA, N. 1.955, MATRICULA 144.225 DO CARTORIO DE REGISTRO DE IMOVEIS DA 2. ZONA DE PORTO ALEGRE, POR IMOVEIS PARTICULARES DE PROPRIEDADE DA SUCESSAO DE ALDO BESSON, LOCALIZADOS NA AVENIDA DIARIO DE NOTICIAS, MATRICULAS N. 46.520, N. 46.521 E N. 46.522, DO CARTORIO DE REGISTRO DE IMOVEIS DA 5. ZONA DESTA CAPITAL, PARA IMPLANTACAO DA ROTATORIA ENTRE AS AVENIDAS, DIARIO DE NOTICIAS, ICARAI E WENCESLAU ESCOBAR.;04/05/2016;DL - DIRETORIA LEGISLATIVA;GOVERNO MUNICIPAL;APROVADO;;11935
649;2015;PLCE;4;DISPOE SOBRE A REGULARIZACAO DE OBRAS CIVIS E CONSTRUCOES DO CONJUNTO HABITACIONAL HEROPHILO AZAMBUJA (IPE II), LOCALIZADO ENTRE AS AVENIDAS PROTASIO ALVES, BENTO GONCALVES E ANTONIO DE CARVALHO, OBJETO DA MATRICULA ORIGINAL N. 62.408, DE PROPRIEDADE DO INSTITUTO DE PREVIDENCIA DO ESTADO DO RIO GRANDE DO SUL (IPERGS), E DA OUTRAS PROVIDENCIAS.;12/05/2016;ARQ - SETOR DE ARQUIVO;GOVERNO MUNICIPAL;APROVADO;;777
600;2015;PLL;58;CONCEDE O TITULO DE CIDADAO DE PORTO ALEGRE AO SENHOR OLY ERICO DA COSTA FACHIN.;10/11/2015;ARQ - SETOR DE ARQUIVO;ALCEU BRASINHA;APROVADO;;11916
597;2015;PR;13;INCLUI CAPITULO IV - DA PROCURADORIA ESPECIAL DA MULHER - , COM ARTS. 86-A A 86-G, NO TITULO II - DOS ORGAOS DA CAMARA MUNICIPAL - DA RESOLUCAO N. 1.178, DE 16 DE JULHO DE 1992 - REGIMENTO DA CAMARA MUNICIPAL DE PORTO ALEGRE - ,E ALTERACOES POSTERIORES,CRIANDO A PROCURADORIA ESPECIAL DA MULHER E DANDO OUTRAS PROVIDENCIAS.;12/05/2016;ARQ - SETOR DE ARQUIVO;SOFIA CAVEDON;APROVADO;;2368
584;2015;PLL;57;INCLUI INC. XVI NO CAPUT DO ART. 2. DA LEI N. 7.855, DE 25 DE SETEMBRO DE 1996 - QUE OFICIALIZA, NO AMBITO DO MUNICIPIO, A SEMANA FARROUPILHA E DA OUTRAS PROVIDENCIAS -, E ALTERACOES POSTERIORES,  INCLUINDO O SINDICATO DOS COMPOSITORES MUSICAIS DO ESTADO DO RS NO ROL DE INSTITUICOES COM REPRESENTACAO NA COMISSAO ESPECIAL RESPONSAVEL PELA PROGRAMACAO DA SEMANA FARROUPILHA.;21/01/2016;ARQ - SETOR DE ARQUIVO;DELEGADO CLEITON;APROVADO;;11941
583;2015;PR;12;CONCEDE A COMENDA PORTO DO SOL A ACADEMIA RIO-GRANDENSE DE LETRAS.;30/11/2015;ARQ - SETOR DE ARQUIVO;LOURDES SPRENGER;APROVADO;;2369
581;2015;PR;11;CONCEDE A COMENDA PORTO DO SOL A FUNDACAO CULTURAL E ASSISTENCIAL ECARTA.;21/01/2016;ARQ - SETOR DE ARQUIVO;SOFIA CAVEDON;APROVADO;;2358
578;2015;PLL;56;DENOMINA RUA DONA FRANSCICA ALVES O LOGRADOURO PUBLICO CADASTRADO CONHECIDO COMO BECO UM - ESTRADA JOAO ANTONIO SILVEIRA -, LOCALIZADO NO BAIRRO LOMBA DO PINHEIRO.;09/03/2016;ARQ - SETOR DE ARQUIVO;MARCIO BINS ELY;APROVADO;;11978
549;2015;PR;9;CRIA 36(TRINTA E SEIS)  CARGOS DE ASSESSOR PARLAMENTAR DE GABINETE, CODIGO 2.1.2.1A, NO ITEM FUNCAO ESPECIFICA DO QUADRO DOS CARGOS EM COMISSAO E FUNCOES GRATIFICADAS DA CAMARA MUNICIPAL DE PORTO ALEGRE, CONSTANTE DO ART. 20, E ALTERA O INC. II DO CAPUT DO ART. 20-A, AMBOS NA LEI N. 5.811, DE 8 DE DEZEMBRO DE 1986, E ALTERACOES POSTERIORES.;19/01/2016;ARQ - SETOR DE ARQUIVO;MESA DIRETORA;APROVADO;;2366
548;2015;PLCE;3;CRIA O FUNDO DE REAPARELHAMENTO E APERFEICOAMENTO PREVIDENCIARIO - FRAP.;05/04/2016;ARQ - SETOR DE ARQUIVO;GOVERNO MUNICIPAL;APROVADO;;762
535;2015;PLL;52;DENOMINA RUA AMELIA SANTINI FORTUNATI O LOGRADOURO PUBLICO NAO CADASTRADO CONHECIDO COMO RUA 1992, LOCALIZADO NO BAIRRO RUBEM BERTA.;18/01/2016;ARQ - SETOR DE ARQUIVO;JOAO CARLOS NEDEL E OUTROS;APROVADO;;11924
481;2015;PLL;46;INCLUI A EFEMERIDE JULHO AMARELO NO ANEXO DA LEI N. 10.904, DE 31 DE MAIO DE 2010 - CALENDARIO DE DATAS COMEMORATIVAS E DE CONSCIENTIZACAO DO MUNICIPIO DE PORTO ALEGRE - E ALTERACOES POSTERIORES, NO MES DE JULHO.;28/03/2016;ARQ - SETOR DE ARQUIVO;MARCIO BINS ELY;APROVADO;;11952
470;2015;PLL;45;INCLUI O EVENTO FEIRA DE ARTE ANTIGA E CONTEMPORANEA DO MERCADO PUBLICO CENTRAL NO ANEXO I DA LEI N. 10.903, DE 31 DE MAIO DE 2010 - CALENDARIO DE EVENTOS DE PORTO ALEGRE E CALENDARIO MENSAL DE ATIVIDADES DE PORTO ALEGRE -, E ALTERACOES POSTERIORES,  EM 1  (UMA)  SEMANA DE CADA MES, E DA OUTRAS PROVIDENCIAS.;09/03/2016;ARQ - SETOR DE ARQUIVO;DR. THIAGO DUARTE                                 ;APROVADO;;11985
467;2015;PLL;44;CONCEDE O TITULO DE CIDADAO EMERITO DE PORTO ALEGRE AO SENHOR CLAUDIO ROBERTO PAGNO DA COSTA.;27/10/2015;ARQ - SETOR DE ARQUIVO;DELEGADO CLEITON;APROVADO;;11879
444;2015;PR;7;CONCEDE O DIPLOMA  HONRA AO MERITO A ASSOCIACAO NACIONAL DE DEFESA E INFORMACAO DO CONSUMIDOR - ANDICOM.;21/01/2016;ARQ - SETOR DE ARQUIVO;MARCIO BINS ELY;APROVADO;;2376
412;2015;PR;6;ESTABELECE REGRAS PARA A CONCESSAO DE DIARIA A VEREADOR E A SERVIDOR DA CAMARA MUNICIPAL DE PORTO ALEGRE OU A DISPOSICAO DESSA E REVOGA A RESOLUCAO N. 907, DE 12 DE AGOSTO DE 1987.;26/10/2015;ARQ - SETOR DE ARQUIVO;MESA DIRETORA;APROVADO;;2374
401;2015;PR;5;CONCEDE O DIPLOMA HONRA AO MERITO A ENTIDADE PACTO PASTORAL DE AUXILIO COMUNITARIO AO TOXICOMANO.;19/01/2016;ARQ - SETOR DE ARQUIVO;ELIZANDRO SABINO;APROVADO;;2378
366;2015;PLL;37;CONCEDE O TITULO DE CIDADAO EMERITO DE PORTO ALEGRE AO CONTADOR ZULMIR IVANIO BREDA.;15/10/2015;ARQ - SETOR DE ARQUIVO;LOURDES SPRENGER;APROVADO;;11888
351;2015;PLL;34;DENOMINA RUA BIAGIO MORELLI O LOGRADOURO NAO CADASTRADO CONHECIDO COMO RUA TRES MIL E SETENTA - JARDIM SAFIRA -, LOCALIZADO NO BAIRRO MARIO QUINTANA.;21/01/2016;ARQ - SETOR DE ARQUIVO;JOAO CARLOS NEDEL;APROVADO;;11861
350;2015;PLL;33;CONCEDE O TITULO DE CIDADAO DE PORTO ALEGRE AO SENHOR SOLIMAR DOS SANTOS AMARO.;18/01/2016;ARQ - SETOR DE ARQUIVO;JOAO CARLOS NEDEL;APROVADO;;11865
347;2015;PLCE;1;"ALTERA O ''CAPUT'', OS INCS. I, II, III, IV, E OS PARAGRAFOS 1., 2., 3. E 4. DO ART. 15, INCLUI INCS. V, VI, VII, VIII E IX E PARAGRAFO 6. NO ''CAPUT'' DO ART. 15; ALTERA O ''CAPUT'' DO ART. 16, RENUMERA O PARAGRAFO UNICO PARA PARAGRAFO 1. ALTERANDO SUA REDACAO, INCLUI INCS. II E II E PARAGRAFO 2., NO ''CAPUT'' DO ART. 16., E ALTERA O ART. 17, TODOS DA LEI COMPLEMENTAR N. 170, DE 31 DE DEZEMBRO DE 1996 - QUE ESTABELECE NORMAS PARA INSTALACOES HIDROSSANITARIAS E SERVICOS PUBLICOS DE ABASTECIMENTO DE AGUA E ESGOTAMENTO SANITARIO PRESTADOS PELO DEPARTAMENTO MUNICIPAL DE AGUA E ESGOTO E DA OUTRAS PROVIDENCIAS -, DISPONDO SOBRE A INTERRUPCAO E SUSPENSAO DO FORNECIMENTO E DO DESLIGAMENTO DO RAMAL DE AGUA.";18/01/2016;ARQ - SETOR DE ARQUIVO;GOVERNO MUNICIPAL;APROVADO;;783
346;2015;PLL;31;INCLUI O EVENTO PORTO ALEGRE OPEN DE TENIS NO ANEXO II DA LEI N. 10.903, DE 31 DE MAIO DE 2010 - CALENDARIO DE EVENTOS DE PORTO ALEGRE E CALENDARIO MENSAL DE ATIVIDADES DE PORTO ALEGRE - , E ALTERACOES POSTERIORES, NO MES DE NOVEMBRO.;19/04/2016;ARQ - SETOR DE ARQUIVO;JOAO CARLOS NEDEL;APROVADO;;11943
338;2015;PLL;30;DENOMINA RUA FREI ROVILIO COSTA O LOGRADOURO NAO CADASTRADO CONHECIDO COMO RUA 2001, LOCALIZADO NO BAIRRO FARRAPOS.;19/01/2016;ARQ - SETOR DE ARQUIVO;JOAO CARLOS NEDEL;APROVADO;;11962
320;2015;PLE;4;DESAFETA PARTE DE AREA DESTINADA A PARQUE NA VILA NOVA RESTINGA, VISANDO REGULARIZAR A ESTACAO DE TRATAMENTO DE ESGOTO (ETE), COM AUTORIZACAO PARA DOACAO AO DEPARTAMENTO MUNICIPAL DE AGUAS E ESGOTOS (DMAE), AUTORIZA DOACAO AO DEPARTAMENTO MUNICIPAL DE HABITACAO (DEMHAB), DE AREA DESTINADA A REGULARIZACAO DO LOTEAMENTO BELA VISTA E AUTORIZA A DESAFETACAO DE AREAS PUBLICAS E COMUNITARIAS DO LOTEAMENTO VILA JARDIM DAS ORQUIDEAS.;19/01/2016;ARQ - SETOR DE ARQUIVO;GOVERNO MUNICIPAL;APROVADO;;11938
270;2015;PLL;26;DENOMINA PRACA DOUTOR ILDO LUIZ ELY O LOGRADOURO PUBLICO NAO CADASTRADO CONHECIDO COMO PRACA MIL, NOVECENTOS E SETENTA E NOVE, LOCALIZADO NO BAIRRO AZENHA.;21/01/2016;ARQ - SETOR DE ARQUIVO;MARCIO BINS ELY;APROVADO;;11917
196;2015;PLL;17;DENOMINA RUA MARIA PAULA LEAL O LOGRADOURO PUBLICO NAO CADASTRADO CONHECIDO COMO RUA 2006 - LOTEAMENTO FREDERICO MENTZ -, LOCALIZADO NO BAIRRO FARRAPOS.;28/03/2016;ARQ - SETOR DE ARQUIVO;JOAO CARLOS NEDEL;APROVADO;;11945
195;2015;PLL;16;CONCEDE O TITULO DE CIDADAO DE PORTO ALEGRE AO SENHOR NEORY MULLER.;15/03/2016;ARQ - SETOR DE ARQUIVO;JOAO DERLY;APROVADO;;11942
180;2015;PLL;15;DENOMINA RUA MARIA FEOLI GUARAGNA O LOGRADOURO NAO CADASTRADO CONHECIDO COMO RUA TRES MIL E SESSENTA E UM - JARDIM SAFIRA -, LOCALIZADO NO BAIRRO MARIO QUINTANA.;21/01/2016;ARQ - SETOR DE ARQUIVO;JOAO CARLOS NEDEL;APROVADO;;11907
171;2015;PLL;13;DENOMINA RUA GAETANO SANTAGADA O LOGRADOURO NAO CADASTRADO CONHECIDO COMO RUA TRES MIL E SESSENTA E SETE - JARDIM SAFIRA -, LOCALIZADO NO BAIRRO MARIO QUINTANA.;05/04/2016;ARQ - SETOR DE ARQUIVO;JOAO CARLOS NEDEL;APROVADO;;11818
167;2015;PLL;10;DENOMINA RUA DOUTORA NUNCIA DE CONSTANTINO O LOGRADOURO NAO CADASTRADO CONHECIDO COMO RUA TRES MIL E SESSENTA E OITO - JADIM SAFIRA -, LOCALIZADO NO BAIRRO MARIO QUINTANA.;21/01/2016;ARQ - SETOR DE ARQUIVO;JOAO CARLOS NEDEL;APROVADO;;11900
166;2015;PLL;9;DENOMINA RUA SANZI BIAGIO O LOGRADOURO NAO CADASTRADO CONHECIDO COMO RUA TRES MIL E SESSENTA E TRES - JARDIM SAFIRA -, LOCALIZADO NO BAIRRO MARIO QUINTANA.;21/01/2016;ARQ - SETOR DE ARQUIVO;JOAO CARLOS NEDEL;APROVADO;;11862
143;2015;PLL;8;DENOMINA RUA CARLOS MOTTA SOBRINHO O LOGRADOURO PUBLICO CADASTRADO CONHECIDO COMO RUA 23 - LOTEAMENTO RESIDENCIAL RUBEM BERTA -, LOCALIZADO NO BAIRRO RUBEM BERTA.;19/01/2016;ARQ - SETOR DE ARQUIVO;ELIZANDRO SABINO;APROVADO;;11910
80;2015;PLL;3;DECLARA DE UTILIDADE PUBLICA O INSTITUTO GERACAO TRICOLOR - IGT.;06/04/2016;ARQ - SETOR DE ARQUIVO;TARCISO FLECHA NEGRA                              ;APROVADO;;11875
53;2015;PLE;1;AUTORIZA O MUNICIPIO DE PORTO ALEGRE A DESAFETAR E A DOAR A ASSOCIACAO COMUNITARIA E CULTURAL QUILOMBO DO AREAL AREAS MUNICIPAIS DESTINADAS AO RECONHECIMENTO DA PROPRIEDADE DEFINITIVA DA AREA QUE DESCREVE E INSTITUI AREA ESPECIAL DE INTERESSE CULTURAR (AEIC), NOS TERMOS DO ART. 92 DA LEI COMPLEMENTAR N. 434, DE 1. DE DEZEMBRO DE 1999 (PDDUA), E ALTERACOES POSTERIORES, NA MESMA AREA.;04/05/2016;DL - DIRETORIA LEGISLATIVA;GOVERNO MUNICIPAL;APROVADO;;11871
3045;2014;PLL;291;DENOMINA RUA IVAR PIAZZETA O LOGRADOURO PUBLICO CADASTRADO CONHECIDO COMO RUA 2086 - LOTEAMENTO PARQUE EMPRESARIAL CONDOR -, LOCALIZADO NO BAIRRO SAO JOAO.;19/01/2016;ARQ - SETOR DE ARQUIVO;IDENIR CECCHIM;APROVADO;;11859
3044;2014;PLL;290;CONCEDE O TITULO DE CIDADAO DE PORTO ALEGRE AO SENHOR CARLOS ALBERTO DE MORAES SCHETTERT.;19/01/2016;ARQ - SETOR DE ARQUIVO;WALDIR CANAL                                      ;APROVADO;;11889
3040;2014;PR;45;CONCEDE A COMENDA PORTO DO SOL A FEDERACAO SINDICAL DOS SERVIDORES PUBLICOS DO ESTADO DO RIO GRANDE DO SUL - FESSERGS.;19/10/2015;PROTOC - SETOR DE PROTOCOLO;PROFESSOR GARCIA;APROVADO;;2359
3039;2014;PLL;287;DECLARA DE UTILIDADE PUBLICA A ASSOCIACAO SUL-RIOGRANDENSE DE APOIO AO DESENVOLVIMENTO DE SOFTWARE - SOFTSUL.;21/01/2016;ARQ - SETOR DE ARQUIVO;JOAO CARLOS NEDEL;APROVADO;;11898
3024;2014;PLL;286;DENOMINA RUA FERNANDO LUCIO DA COSTA O LOGRADOURO NAO CADASTRADO CONHECIDO COMO RUA B - SPORT CLUB INTERNACIONAL -, LOCALIZADO NO BAIRRO PRAIA DE BELAS.;25/05/2016;ARQ - SETOR DE ARQUIVO;MESA DIRETORA E OUTROS;APROVADO;;11918
3023;2014;PLL;285;DENOMINA RUA NESTOR LUDWIG O LOGRADOURO NAO CADASTRADO CONHECIDO COMO RUA A - SPORT CLUB INTERNACIONAL -, LOCALIZADO NO BAIRRO PRAIA DE BELAS.;25/05/2016;ARQ - SETOR DE ARQUIVO;MESA DIRETORA E OUTROS;APROVADO;;11919
3022;2014;PLL;284;DENOMINA RUA CARLOS MEDINA O LOGRADOURO NAO CADASTRADO CONHECIDO COMO RUA C - SPORT CLUB INTERNACIONAL -, LOCALIZADO NO BAIRRO PRAIA DE BELAS.;03/05/2016;ARQ - SETOR DE ARQUIVO;MESA DIRETORA E OUTROS;APROVADO;;11897
3012;2014;PR;43;CONCEDE O DIPLOMA HONRA AO MERITO AO GRUPO HABITASUL.;05/04/2016;ARQ - SETOR DE ARQUIVO;REGINALDO PUJOL;APROVADO;;2382
2994;2014;PLL;280;CONCEDE O TITULO DE CIDADAO DE PORTO ALEGRE AO SENHOR LUIZ ALBERTO BARICHELLO.;04/04/2016;ARQ - SETOR DE ARQUIVO;ENGENHEIRO COMASSETTO                             ;APROVADO;;11930
2993;2014;PLL;279;INCLUI PARAGRAFO UNICO NO ART. 64 DA LEI N. 6.310, DE 29 DE DEZEMBRO DE 1988 - QUE ESTABELECE O PLANO DE CARREIRA DOS FUNCIONARIOS DO DEPARTAMENTO MUNICIPAL DE HABITACAO (DEMHAB), DISPOE SOBRE O PLANO DE PAGAMENTO E DA OUTRAS PROVIDENCIAS -, E ALTERACOES POSTERIORES, ESTENDENDO GRATIFICACAO POR ATIVIDADE ESPECIAL A DETENTORES DO CARGO DE GUARDA MUNICIPAL QUE ESPECIFICA.;04/11/2015;ARQ - SETOR DE ARQUIVO;CASSIO TROGILDO;APROVADO;VETO TOTAL MANTIDO;
2971;2014;PR;42;CONCEDE O DIPLOMA HONRA AO MERITO A ASSOCIACAO BENEFICENTE E CULTURAL IRAJA DE ALMEIDA GUTERRES - SAMBA DO IRAJA.;17/11/2015;ARQ - SETOR DE ARQUIVO;JOAO BOSCO VAZ;APROVADO;;2373
2938;2014;PLCL;31;CRIA E INSTITUI COMO AREA ESPECIAL DE INTERESSE INSTITUCIONAL - AEII - A SUBUNIDADE 05 NA UNIDADE DE ESTRUTURACAO URBANA - UEU - 66 DA MACROZONA - MZ - 01, CONSTITUIDA PELO CONJUNTO DE TERRENOS OCUPADOS PELO COMPLEXO HOSPITALAR MAE DE DEUS, DEFINE-LHE REGIME URBANISTICO E PADROES PARA CALCULO DE GUARDA DE VEICULOS E ALTERA LIMITES DAS SUBUNIDADES 01 E 02 DESSA UEU.;06/04/2016;ARQ - SETOR DE ARQUIVO;MARCIO BINS ELY;APROVADO;;764
2923;2014;PR;40;CONCEDE A COMENDA PORTO DO SOL AO SENHOR PAULO MONTEIRO FREITAS.;21/01/2016;ARQ - SETOR DE ARQUIVO;NEREU D'AVILA;APROVADO;;2357
2922;2014;PLL;272;CONCEDE O TITULO DE CIDADAO DE PORTO ALEGRE AO SENHOR DAVID NUNES.;21/01/2016;ARQ - SETOR DE ARQUIVO;GUILHERME SOCIAS VILLELA;APROVADO;;11851
2916;2014;PR;39;CONCEDE O DIPLOMA HONRA AO MERITO A EMPRESA REFUGIU'S BAR LTDA.;18/01/2016;ARQ - SETOR DE ARQUIVO;MAURO PINHEIRO;APROVADO;;2372
2910;2014;PLL;270;CONCEDE O TITULO DE CIDADAO DE PORTO ALEGRE AO SENHOR ALOYZIO CECHELLA ACHUTTI.;19/01/2016;ARQ - SETOR DE ARQUIVO;WALDIR CANAL                                      ;APROVADO;;11844
2908;2014;PLL;269;CONCEDE O TITULO DE CIDADAO EMERITO DE PORTO ALEGRE AO SENHOR ANTONIO CARLOS CORTES.;21/01/2016;ARQ - SETOR DE ARQUIVO;JOAO BOSCO VAZ;APROVADO;;11878
2873;2014;PLL;267;CONCEDE O TITULO DE CIDADAO DE PORTO ALEGRE AO SENHOR ANTONIO CESA LONGO.;21/01/2016;ARQ - SETOR DE ARQUIVO;MAURO PINHEIRO;APROVADO;;11932
2869;2014;PLL;265;CONCEDE O TITULO DE CIDADAO DE PORTO ALEGRE AO SENHOR ANDRES NICOLAS D'ALESSANDRO.;21/01/2016;ARQ - SETOR DE ARQUIVO;MARIO MANFRO                                      ;APROVADO;;11835
2815;2014;PLL;259;DENOMINA RUA PROVINCIA AUTONOMA DE TRENTO O LOGRADOURO PUBLICO CADASTRADO CONHECIDO COMO RUA 7063 - LOTEAMENTO LAGOS DE NOVA IPANEMA III -, LOCALIZADO NO BAIRRO HIPICA.;21/01/2016;ARQ - SETOR DE ARQUIVO;AIRTO FERRONATO;APROVADO;;11863
2811;2014;PLL;257;INCLUI A EFEMERIDE PROCISSAO DE NOSSA SENHORA DAS GRACAS DA MEDALHA MILAGROSA NO ANEXO DA LEI N. 10.904, DE 31 DE MAIO DE 2010 - CALENDARIO DE DATAS COMEMORATIVAS E DE CONSCIENTIZACAO DO MUNICIPIO DE PORTO ALEGRE -, E ALTERACOES POSTERIORES, NO QUARTO DOMINGO DE NOVEMBRO.;25/09/2015;DL - DIRETORIA LEGISLATIVA;PROFESSOR GARCIA;APROVADO;;11892
2806;2014;PLL;256;DECLARA DE UTILIDADE PUBLICA A ASSOCIACAO GAUCHA AMIGOS DO CIRCO.;15/03/2016;ARQ - SETOR DE ARQUIVO;SOFIA CAVEDON;APROVADO;;11973
2804;2014;PLL;255;DENOMINA PRACA RITA BRANDAO SEGER O LOGRADOURO PUBLICO NAO CADASTRADO CONHECIDO COMO PRACA 3732,LOCALIZADO NO BAIRRO JARDIM ITU SABARA.;18/01/2016;ARQ - SETOR DE ARQUIVO;JOAO CARLOS NEDEL;APROVADO;;11899
2803;2014;PLL;254;INCLUI NO ANEXO II DA LEI N. 10.903, DE 31 DE MAIO DE 2010 - CALENDARIO DE EVENTOS DE PORTO ALEGRE E CALENDARIO MENSAL DE ATIVIDADES DE PORTO ALEGRE -, E ALTERACOES POSTERIORES, O EVENTO NATAL NA PRACA, EM PERIODO DO MES DE DEZEMBRO, A SER DEFINIDO ANUALMENTE.;18/01/2016;ARQ - SETOR DE ARQUIVO;REGINALDO PUJOL;APROVADO;;11857
2791;2014;PLL;253;DENOMINA RUA DORA SCHARDONG O LOGRADOURO PUBLICO CADASTRADO CONHECIDO COM RUA SETE MIL, CENTO E NOVENTA E UM, LOCALIZADO NO BAIRRO RESTINGA.;19/01/2016;ARQ - SETOR DE ARQUIVO;JOAO CARLOS NEDEL;APROVADO;;11904
2783;2014;PLCE;14;ALTERA O ''CAPUT'' DO ART. 15, O INC. IX DO ART. 16, O ART. 17 E INCLUI O ART. 17-A, TODOS DA LEI COMPLEMENTAR N. 721, DE 29 DE NOVEMBRO DE 2013, - QUE ESTABELECE MEDIDAS DE INCENTIVO E APOIO A INOVACAO E A PESQUISA CIENTIFICA E TECNOLOGICA NO AMBITO EMPRESARIAL, ACADEMICO E SOCIAL NO MUNICIPIO DE PORTO ALEGRE, - MODIFICANDO A CONSTITUICAO DO CONSELHO GESTOR E DANDO OUTRAS PROVIDENCIAS.;26/07/2016;ARQ - SETOR DE ARQUIVO;GOVERNO MUNICIPAL;APROVADO;;781
2746;2014;PLL;251;CONCEDE  O TITULO DE CIDADAO DE PORTO ALEGRE, IN MEMORIAM,  AO EX-JOGADOR DE FUTEBOL FERNANDO LUCIO DA COSTA.;09/08/2016;ARQ - SETOR DE ARQUIVO;NEREU D'AVILA;APROVADO;;11800
